Name,Experience,Skills,Education,Location
Rahul Kumar,5,"Python, Machine Learning, Data Analysis, SQL, AWS","B.Tech in Computer Science, IIT Delhi",Bangalore
Priya Singh,3,"Java, Spring Boot, MySQL, React, Docker","B.E in Information Technology, BITS Pilani",Mumbai
Amit Patel,4,"JavaScript, Node.js, MongoDB, Express, React","M.Tech in Software Engineering, NIT Surathkal",Hyderabad
Neha Sharma,2,"Python, Django, PostgreSQL, HTML, CSS","B.Tech in Computer Engineering, VIT Vellore",Delhi
Vikram Reddy,6,"Java, Kubernetes, DevOps, Azure, Jenkins","M.S in Computer Science, IIIT Bangalore",Chennai